commit	kv_dtype	d64	d512	d2048	d8192	d32768	e64	e512	e2048	e8192	e32768	geo	status	description
1c434e06	bf16	0.000	0.000	0.000	0.000	0.000	1.375	1.049	1.040	1.030	1.017	1.111	discard	minimax bf16 decode selective merge async issue reorder for bs1+bs3 only; clean after compile fix but e64/e2048/e32768 trail 659650ed and the rs4 reorder does not transfer as a selective stack, reverting
b5bdbf3c	bf16	0.000	0.000	0.000	0.000	0.000	1.390	1.047	1.041	1.026	1.017	1.110	discard	minimax bf16 decode producer warp role swap for role-specialized path; producer moved to physical warp0 with consumer remap, correctness clean but e512/e2048/e8192/e32768 trail 659650ed so reverting
430400cc	bf16	0.000	0.000	0.000	0.000	0.000	1.373	1.047	1.043	1.031	1.015	1.111	discard	minimax bf16 decode QK TMA plane bank-rotate with 128B aligned per-plane K padding; clean after 16B alignment fault but only e8192 moves +0.002 while e64/e512/e2048/e32768 trail 659650ed, reverting
e0e09424	bf16	0.000	0.000	0.000	0.000	0.000	1.353	1.052	1.042	1.028	1.015	1.113	candidate	minimax bf16 decode V TMA plane bank-rotate with 128B aligned per-plane V padding; e512 floor lifts +0.003 but other floors trail 659650ed, rerunning before keep or revert
e0e09424	bf16	0.000	0.000	0.000	0.000	0.000	1.373	1.051	1.045	1.031	1.018	1.111	discard	minimax bf16 decode V TMA plane bank-rotate rerun; e512 lift fades below +0.003 and headline trails 659650ed, no confirmed floor win so reverting
a963ba73	bf16	0.000	0.000	0.000	0.000	0.000	1.383	0.148	0.122	0.106	0.097	0.717	discard	minimax bf16 decode bs1 direct writeback by stripping split-kv for the exact bs1 graph geometry; skips merge and improves bs1 ctx128 but long contexts collapse from lost split parallelism, reverting
ac2351be	bf16	0.000	0.000	0.000	0.000	0.000	1.396	1.051	1.041	1.030	1.020	1.113	candidate	minimax bf16 decode merge packed v2 writeback; first sample lifts the short floor past the candidate bar and nudges max context, but e2048 regresses versus 659650ed so rerunning before keep or revert
ac2351be	bf16	0.000	0.000	0.000	0.000	0.000	1.391	1.054	1.042	1.025	1.014	1.114	keep	minimax bf16 decode merge packed v2 writeback rerun; e64 and e512 floor lifts confirm above the candidate bar and focused decode graph guardrails pass, keeping as a probe despite e2048/e8192/e32768 tradeoffs
c3f61ee2	bf16	0.000	0.000	0.000	0.000	0.000	1.377	1.039	1.045	1.030	1.017	1.110	candidate	minimax bf16 decode direct merge partial loads via v2.u32 on top of packed writeback; recovers deeper floors versus ac2351be by candidate-sized deltas but short/e512 and geo regress, rerunning before revert
c3f61ee2	bf16	0.000	0.000	0.000	0.000	0.000	1.343	1.040	1.046	1.027	1.019	1.108	discard	minimax bf16 decode direct merge partial v2 loads rerun; e2048/e32768 recovery confirms but e64/e512 collapse and geo fall well below ac2351be, reverting the load path
05013adc	bf16	0.000	0.000	0.000	0.000	0.000	1.406	1.050	1.038	1.026	1.014	1.111	candidate	minimax bf16 decode small-fanin packed writeback gate; short floor jumps above ac2351be by +0.015 but e512/e2048 and headline give back too much, rerunning before keep or revert
05013adc	bf16	0.000	0.000	0.000	0.000	0.000	1.383	1.045	1.038	1.030	1.018	1.112	discard	minimax bf16 decode small-fanin packed writeback gate rerun; short lift does not confirm and e512/e2048/headline trail ac2351be, deep recovery is not enough to replace the packed-writeback keep
24c6f801	bf16	0.000	0.000	0.000	0.000	0.000	1.409	1.048	1.041	1.022	1.018	1.113	candidate	minimax bf16 decode direct-normalized packed writeback; removes the final state_o normalization loop for BF16 stores and lifts e64/e32768 past the candidate bar, rerunning before keep or revert
24c6f801	bf16	0.000	0.000	0.000	0.000	0.000	1.352	1.041	1.039	1.029	1.016	1.109	discard	minimax bf16 decode direct-normalized packed writeback rerun; candidate e64/e32768 lifts do not hold and headline drops below the packed-writeback keep, reverting
5f7fe8e4	bf16	0.000	0.000	0.000	0.000	0.000	1.350	1.051	1.044	1.029	1.011	1.111	candidate	minimax bf16 decode merge-stage BF16 smem bank rotate; padded staged partial rows are correctness-clean after fixing cp.async strides and lift e8192 by candidate-sized delta, rerunning before keep or revert
5f7fe8e4	bf16	0.000	0.000	0.000	0.000	0.000	1.370	1.049	1.040	1.029	1.018	1.111	discard	minimax bf16 decode merge-stage BF16 smem bank rotate rerun; deep-cell recovery confirms but only by giving back packed-writeback e64/e512/e2048 gains and headline stays below ac2351be, reverting
113ff269	bf16	0.000	0.000	0.000	0.000	0.000	1.370	1.041	1.036	1.022	1.014	1.108	discard	minimax bf16 decode merge LSE warp broadcast; lane0 LSE load plus warp shuffle is correctness-clean after DSL fix but all floors/headline trail ac2351be with no candidate-sized lift, reverting
260af065	bf16	0.000	0.000	0.000	0.000	0.000	1.344	1.048	1.046	1.033	1.014	1.108	candidate	minimax bf16 decode rs4 2682bed4 merge async issue reorder stacked on packed-writeback base; e2048/e8192 floors lift by candidate-sized deltas but e64/e512 and headline regress, rerunning before keep or revert
260af065	bf16	0.000	0.000	0.000	0.000	0.000	1.348	1.042	1.042	1.027	1.015	1.110	discard	minimax bf16 decode rs4 merge async issue reorder on packed-writeback rerun; e2048 lift vanishes and e8192 is below the candidate bar while e64/e512/headline trail ac2351be, reverting
